{
  "schema": "emuflow.runtime-sync-provider/v1",
  "id": "emuflow-runtime-sync-tree-v1",
  "qualification": "editable_source_hardware",
  "modules": {
    "tree_node": "emuflow_runtime_sync_tree_node"
  },
  "implementation": {
    "algorithm": "rooted-tree-future-epoch-barrier",
    "fault_policy": "sticky-fault-requires-global-reset"
  },
  "source_root": "../..",
  "sources": [
    {
      "path": "rtl/runtime_sync/emuflow_runtime_sync_tree_node.sv",
      "language": "systemverilog",
      "role": "synthesizable rooted-tree startup barrier",
      "sha256": "236d3e495d002b88a3a6148fdd03ae31719580d4d62d5f0a1a6b9dcab5d8ef63"
    }
  ],
  "requirements": {
    "fabric_clock": "phase-aligned-common-frequency",
    "reset_release": "synchronous-all-fpgas",
    "control_transport": "lossless-ordered-tree-links"
  },
  "provenance": {
    "license": "Apache-2.0",
    "upstream": "https://github.com/ZeayW/FGPA_emulation"
  }
}
